"DESCRIPTION","DURATION IN MS","NAME","PARENT SUITE","START TIME","STATUS","STOP TIME","SUB SUITE","SUITE","TEST CLASS","TEST METHOD"
"","2740","Search for different products by name (example #3)","","Thu Jul 17 23:43:18 UTC 2025","passed","Thu Jul 17 23:43:21 UTC 2025","","Product search","",""
"","3045","Attempt to search without sending the 'search_product' parameter","","Thu Jul 17 23:43:36 UTC 2025","passed","Thu Jul 17 23:43:40 UTC 2025","","Product search without passing ""product"" parameter","",""
"","2553","Search for different products by name (example #4)","","Thu Jul 17 23:43:21 UTC 2025","passed","Thu Jul 17 23:43:23 UTC 2025","","Product search","",""
"","2314","The user selects a specific quantity of a product and verifies it in the cart","","Thu Jul 17 23:43:31 UTC 2025","passed","Thu Jul 17 23:43:34 UTC 2025","","Verify product quantity in the cart","",""
"","3829","The user adds two products to the cart from the products page","","Thu Jul 17 23:43:06 UTC 2025","passed","Thu Jul 17 23:43:09 UTC 2025","","Add products to the cart","",""
"","2576","Verify all products and the product detail page","","Thu Jul 17 23:43:26 UTC 2025","passed","Thu Jul 17 23:43:29 UTC 2025","","Product visualization","",""
"","2429","Search for different products by name (example #2)","","Thu Jul 17 23:43:16 UTC 2025","passed","Thu Jul 17 23:43:18 UTC 2025","","Product search","",""
"","3345","Search for different products by name (example #1)","","Thu Jul 17 23:43:12 UTC 2025","passed","Thu Jul 17 23:43:16 UTC 2025","","Product search","",""
