"DESCRIPTION","DURATION IN MS","NAME","PARENT SUITE","START TIME","STATUS","STOP TIME","SUB SUITE","SUITE","TEST CLASS","TEST METHOD"
"","2678","Search for different products by name (example #3)","","Tue Jul 15 22:05:15 UTC 2025","passed","Tue Jul 15 22:05:18 UTC 2025","","Product search","",""
"","2680","Search for different products by name (example #4)","","Tue Jul 15 22:05:18 UTC 2025","passed","Tue Jul 15 22:05:21 UTC 2025","","Product search","",""
"","2714","Verify all products and the product detail page","","Tue Jul 15 22:05:22 UTC 2025","passed","Tue Jul 15 22:05:25 UTC 2025","","Product visualization","",""
"","3452","Search for different products by name (example #1)","","Tue Jul 15 22:05:09 UTC 2025","passed","Tue Jul 15 22:05:12 UTC 2025","","Product search","",""
"","2827","Search for different products by name (example #2)","","Tue Jul 15 22:05:12 UTC 2025","passed","Tue Jul 15 22:05:15 UTC 2025","","Product search","",""
"","2321","The user selects a specific quantity of a product and verifies it in the cart","","Tue Jul 15 22:05:27 UTC 2025","passed","Tue Jul 15 22:05:29 UTC 2025","","Verify product quantity in the cart","",""
"","3356","Attempt to search without sending the 'search_product' parameter","","Tue Jul 15 22:05:30 UTC 2025","passed","Tue Jul 15 22:05:34 UTC 2025","","Product search without passing ""product"" parameter","",""
"","3958","The user adds two products to the cart from the products page","","Tue Jul 15 22:05:03 UTC 2025","passed","Tue Jul 15 22:05:07 UTC 2025","","Add products to the cart","",""
